,text,subreddit,title,author,created,topic_BLM
0,Yep. So far i would say if worst came to worst atleast 45% of the military would refuse to fight american citizens. Thats a rough estimate could me more or less,2020PoliceBrutality,Can we talk about this new ‘Operation Legend’?,tacoim,2020-07-23 2:25,0
1,I feel so much fear and anxiety all the time. I live in Oregon. My dad works in downtown Portland. He eats all the conservative propaganda and thinks I’m an idiot for being concerned about the mysterious federal police force roaming the streets capturing people in vans.  My dad now due to people being laid off now has to essentially do security in addition to his job. Square in the middle of downtown Portland. It’s a little worrying to me and especially my mom. Every day he sends me shit complaining about the protestors and will show me graffiti he has to clean up and anytime I show him police brutality he is gleeful and doesn’t care. My mom is suicidal now too that’s a new development. Things have escalated and our family is just really frustrated with how unempathetic he seems. I know that seems dumb but man things are hard right now and like I’ve  been suicidal since I was like 11 and I’m 24 now. That’s not really relevant just like damn am I’m having an extra bad time I was mentally strained before this. I need peace in my family. Does anyone have any links I can send or show my dad in person (when I text him he doesn’t listen) to maybe change his mind?,2020PoliceBrutality,I need peace in my family. Anyone have any articles or podcasts or anything suggestions for is objectively going on in the simplest terms in Portland and why he shouldn’t just dismiss the protestors just because some have been rude and violent to and near him,Cham-Clowder,2020-07-20 11:04,0
2,Portland is going to skyrocket to the top again. i am out there constantly and i still gasp when i see videos.,2020PoliceBrutality,Wanted to give y'all an update on our count. Cities with the most police brutality incidents since 5/26 (protest only),helicopter_corgi_mom,2020-07-18 0:34,0
3,"Use the bubbling hate it generates to fund the energy to do more in my life to improve until I can get well enough to help and to encourage, inform, and aid allies who are out in the field currently.",2020PoliceBrutality,How do you cope with the emotions of subscribing to this sub? [2020PoliceBrutality],seraphsrage,2020-07-12 23:24,0
4,"I have recently rediscovered metal music. I loved it as a teen, but grew out of it eventually. Current circumstances have led me back down the path of headbanging every day. It is a VERY healthy anger outlet for me compared to crying and shaking in rage as I chug a shot. Some of my new favorites:[Make Them Suffer - Bones](https://www.youtube.com/watch?v=taBVhtPbT5c)[I Prevail - Gasoline](https://www.youtube.com/watch?v=0Eh4b0Ge-sM) - The video for this one is insanely good, don't skip it.[Crystal Lake - Apollo](https://www.youtube.com/watch?v=jX8RTjUUcLE) - This band is so good that even my 90's hip-hop-loving wife has been listening to them while working.",2020PoliceBrutality,How do you cope with the emotions of subscribing to this sub? [2020PoliceBrutality],kpolar,2020-07-15 7:49,1
5,"Weed? I don't know man, these last few months have hurt my heart so much. I don't know if I'm coping as much as just learning to live with it.",2020PoliceBrutality,How do you cope with the emotions of subscribing to this sub? [2020PoliceBrutality],berry00,2020-07-18 17:57,0
6,"it sucks big time that I have to come to reddit of all places to get a more accurate view of things going on, sometimes in my own city even. I use the rage and the emotions I feel and I put that into helping my community as much as I can. I can't do much due to what's going on and my health, but if even just the tiniest thing I can do can help someone in any way I am glad to do it. These videos are very hard to watch but it's important to get the perspective that we don't get on the national or even sometimes local news. As far as coping strategies, I try to take time to meditate and destress. I know it sounds cliche but it can help to focus on a mantra and clear your mind, and point yourself in a direction where you can use that anger to do something good, and not let it simmer inside you or burst out in an uncontrolled way .",2020PoliceBrutality,How do you cope with the emotions of subscribing to this sub? [2020PoliceBrutality],SailorSunBear,2020-07-23 6:53,0
7,"The primary purpose of this group is to showcase police brutality.I come from a mixed family (you name it, we got it). My grandmother is a person of color. I fear for my family every single time I hear about police violence.I called my grandmother to express this. It was the first time we had a real conversation about race. It was a  hard conversation to have - we weren't addressing my fears!She said, ""Dave, it is so dangerous being a black man in America. Don't personalize it.""And that's just it. I personalize a problem I shouldn't. That conversation helped me identify what I can - and should - take responsibility for. Identification is only the first step in the process of healing.I have to believe that it will get better. I have to believe in something bigger than mr. I have to relinquish control of the things I cannot. It is hard, especially when I believe I, myself, am the difference. It's not so simple...In fear, I lose track of who I am and the principles I live by. I have to take an honest, fearless look at myself. It is not easy, but helps with identifying my part. I need to share these things with someone I trust - anyone or anything, even the spiritual. I'm fortunate to have close friends and professionals I can discuss these things with and some conception of a Universal power that will listen. I learn more about myself when I listen to these things. I have to pray that the defaults of character which affect my usefulness to others can be removed, but first I have to be willing. Identifying what's what in this sense requires time and meditative practice. One way or another, I may have caused harm to someone else, and I need to be willing to make amends - and then do it. I'm not perfect, sometimes I slip. I should be accountable for such occurrences.In the meantime, I take a moment to pause and reflect - is there something I'm not doing? What is the next best thing - good orderly direction? How can I be of service How can I further connect with this Universal power?Lastly, I have to carry this on - to help those who are suffering. I don't know if this is the solution for you, but so far, it has worked for me.If you - any of you - have any questions, feel free to DM me.",2020PoliceBrutality,How do you cope with the emotions of subscribing to this sub? [2020PoliceBrutality],thisisnotyourpoop,2020-07-26 17:53,1
8,I alternate between r/2020PoliceBrutality and r/aww or r/AnimalsBeingBros or I go pet my Dogs for a while.There are times when I've found myself diving into a thread and just have to put it down.  It's hard to keep perspective.  The level of vitriol and anger in some of the threads is stunning.  The level of brutality that is on display is depressing.,2020PoliceBrutality,How do you cope with the emotions of subscribing to this sub? [2020PoliceBrutality],EmperorGeek,2020-07-28 3:44,0
9,I’ve been working out super mad these past few months. That’s been helping. But lately I’ve been pretty discouraged. There’s so many examples of violent and borderline murderous police and it’s crushing that nothing has changed.,2020PoliceBrutality,How do you cope with the emotions of subscribing to this sub? [2020PoliceBrutality],Tyger-King,2020-08-02 16:30,0
10,"I've been following police murders, brutality, and injustice for about 7 years now. It still makes me angry every single time. I cannot become numb to this, with that said, I've started to look for ways to channel this energy into something positive for everyone but I'm having a hard time on what that should be",2020PoliceBrutality,How do you cope with the emotions of subscribing to this sub? [2020PoliceBrutality],redtape44,2020-08-04 14:08,0
11,Who said I was coping? Lol jkIdk man some people just are unable to cope; and I’m pretty sure that’s fine.  Who knows you may be able to cope with something I can’t,2020PoliceBrutality,How do you cope with the emotions of subscribing to this sub? [2020PoliceBrutality],CentralFloridaMan,2020-08-06 6:36,0
12,"Tbh, ive just kinda grown numb to it all. Ive seen so much about it, that seeing the cruelty doesn’t phase me anymore. Though, sometimes it really gets to me. When it does, I turn to DnD and drawing to cope",2020PoliceBrutality,How do you cope with the emotions of subscribing to this sub? [2020PoliceBrutality],He_Screm,2020-09-15 3:53,0
13,"I use this subreddit to cope. I often get caught up in my own head, and this sub helps me realize how privileged I really am. I've never experienced what gets posted here, and I doubt I will. I've been to one protest in my states capital, and thankfully, nothing bad happened.",2020PoliceBrutality,How do you cope with the emotions of subscribing to this sub? [2020PoliceBrutality],Qonnor64,2020-07-16 2:42,0
14,"Not gonna lie, after weeks of seeing all this carnage, it's finally getting to me. That Kenosha shooting really sent that feeling over the edge. I need to purge all this bullshit for a few days, but at the same time I don't wanna be uninformed about anything happening. And shit happens every fuckin day nowMy soul just hurts",2020PoliceBrutality,How do you cope with the emotions of subscribing to this sub? [2020PoliceBrutality],IHEARTASBESTOS,2020-08-27 15:44,0
15,"Really good question.  I don’t handle it well and it has isolated me from others.  In return, I know it is my duty to watch.  This is America.   But also our moment.  We can do this   Sadly not without decades of institutional harm and great sacrifice. Seeing this post makes one feel less alone.  More likely to succeed.",2020PoliceBrutality,How do you cope with the emotions of subscribing to this sub? [2020PoliceBrutality],Roger-the-Hat,2020-08-28 3:40,0
16,"Know that it has been going on since the beginning of time! We live in a time where it is instantly seen by all of us. The only solution is to turn off the internet and self improve. Or gather up with other good people and try to be heard. It's not the happiest of times. But all across the world people are revolting against their governments. We are 50 fold their numbers so change will happen, no matter how many lies they feed us!",2020PoliceBrutality,How do you cope with the emotions of subscribing to this sub? [2020PoliceBrutality],Bludmaker,2020-09-01 0:11,1
17,Sadly I am alone during the pandemic and I don't feel the friends I have need to hear more about it. Most of my friends are already sympathetic to the issues or too mentally fucked up to handle it. Also not being irl when talking about this stuff sucks. Are there places where you are able to talk to strangers about this stuff?,2020PoliceBrutality,How do you cope with the emotions of subscribing to this sub? [2020PoliceBrutality],lunar_limbo,2020-07-12 20:37,1
18,I'm with you. Maybe it's also the pandemic being alone stuff that's letting it build up in me. I am trying my best to be prepared to go to the March on Washington in late August but I have a lot to do to be ready for that. Are other people on this sub talking about the emotional affects of this somewhere?,2020PoliceBrutality,How do you cope with the emotions of subscribing to this sub? [2020PoliceBrutality],lunar_limbo,2020-07-12 20:39,0
19,"What time of day do you find yourself looking through this sub? Maybe you could tell yourself, no more police brutality after 3pm, like someone might do with caffeine?",2020PoliceBrutality,How do you cope with the emotions of subscribing to this sub? [2020PoliceBrutality],lunar_limbo,2020-07-13 14:25,0
20,Despite the current climate is still shocks me the media isn't covering anything anymore. Sigh. I think the most common thing that happens to me is I feel that rage then I feel utterly helpless. I am partially disabled and even planning to go to the March on Washington is a huge process for me. IS there anything you are doing to allow that rage to leave your body? Someone above suggested using physical  exercise which I think sounds pretty good.,2020PoliceBrutality,How do you cope with the emotions of subscribing to this sub? [2020PoliceBrutality],lunar_limbo,2020-07-13 16:56,1
21,I appreciate that. I'm not very familiar with anger and hate feelings. I used to always direct that energy at myself instead of at those who hurt me. How do you not get consumed by the hate? Do you feel jaded by it?,2020PoliceBrutality,How do you cope with the emotions of subscribing to this sub? [2020PoliceBrutality],lunar_limbo,2020-07-12 23:47,1
22,I think I did really hit the end. I get a full hollow feeling watching a video that feels like a black hole in my heart. On the other hand look at Hong Kong. Different circumstance but it's been over a year now... With a lot of things now I used to trust they would balance out over time but I feel like we could head towards catastrophic. I hope you are right,2020PoliceBrutality,How do you cope with the emotions of subscribing to this sub? [2020PoliceBrutality],lunar_limbo,2020-07-17 2:45,0
23,"Meditation has been extremely tough for me due to chronic pain. In this context it is hard for me to imagine meditation being helpful if you have yet to figure out how to act on these feelings.Like if I knew I was going to volunteer doing x, then meditation would help me recenter around that goal or something when I get sad or overwhelmed by the videos. Is this how it works for you or does the meditation do something else?",2020PoliceBrutality,How do you cope with the emotions of subscribing to this sub? [2020PoliceBrutality],lunar_limbo,2020-07-25 10:10,0
24,Has watching all this violence hurt you or changed your emotions in any way? Is there anything you do to make sure the mad doesn't ruin every day?,2020PoliceBrutality,How do you cope with the emotions of subscribing to this sub? [2020PoliceBrutality],lunar_limbo,2020-08-11 11:57,0
25,"Awesome reply. Reminds me of a quote I read long ago which reads ""When you get tired, learn to rest, not to quit"". Or something like that. It is shocking how reminders like yours and that quote can be so quickly forgotten. How poorly we seem to be as a society with handling our emotions. Did we ever used to be better? Or is this the best we've ever been?",2020PoliceBrutality,How do you cope with the emotions of subscribing to this sub? [2020PoliceBrutality],lunar_limbo,2020-08-18 14:41,0
26,"Thanks for adding how you cope with all this. Animals being Bros is a fun sub. I guess something that's hit me again because of all this is how ""fun"" hate and anger is. It appears to me the people who have it enjoy it. Really hard to swallow that",2020PoliceBrutality,How do you cope with the emotions of subscribing to this sub? [2020PoliceBrutality],lunar_limbo,2020-07-28 19:45,1
27,"Thank you for the recommendations. I hope others see your comment. It makes me happy people are still commentating despite the age of the post. I really hope we are in a meaningful transition period with long lasting positive outcome. An older friends I have looked to remind me she thinks Trump being in office has woken people up where Hillary might not have. You mention ""we"" in your comment a few times. Do you mind sharing what you mean?",2020PoliceBrutality,How do you cope with the emotions of subscribing to this sub? [2020PoliceBrutality],lunar_limbo,2020-08-07 7:18,1
28,"Now that is the kind of conviction, fortitude, and courage I wish I had. When did you decide you run and how to l did you come to that decision?",2020PoliceBrutality,How do you cope with the emotions of subscribing to this sub? [2020PoliceBrutality],lunar_limbo,2020-08-26 3:00,0
29,I feel ya. I've truly but my limit. The feeling I get watching anything is too much. Doing my best to prepare for August. Is there anything you do to help yourself?,2020PoliceBrutality,How do you cope with the emotions of subscribing to this sub? [2020PoliceBrutality],lunar_limbo,2020-07-22 2:57,0
30,I'm right there with you. How can that situation warrant seven shots and to the back? Why can't cops de-escalate? How could they openly praise the militia guys and ignore the shooter? Or tell the militia they will push protesters to them and leave? Take a few days. I give you permission. You are allowed to. And you don't need my permission. But taking a break helped me. And now I'm fired up again.,2020PoliceBrutality,How do you cope with the emotions of subscribing to this sub? [2020PoliceBrutality],lunar_limbo,2020-08-27 16:35,1
31,Quitting is hard! This year would be the hardest to quit as well.I've been on the quit train for about four years. Gas mileage success with people if months. But this time I haven't had one since December. Have you had any success yet? How long have you been trying?,2020PoliceBrutality,How do you cope with the emotions of subscribing to this sub? [2020PoliceBrutality],lunar_limbo,2020-09-13 13:53,1
32,I am equally disturbed by what's happening in Hong Kong. I am hopeful to think we are in this chapter of history because of the internet. Global instant communication has ushered about a totally new existence for humans. Let's hope we figure it out.,2020PoliceBrutality,How do you cope with the emotions of subscribing to this sub? [2020PoliceBrutality],lunar_limbo,2020-09-13 15:46,0
33,"Well, I would say this sub should be a good place to talk about it but normally it's not. Sadly, most conversations are something like ""all cops are pigs. All pigs are bad"". There's not alot of subtlety. Mostly just anger which doesn't really get us, as a society, to a place where we don't have to witness police brutalizing their fellow citizens.  I'd also say that it's totally okay to take a break for a while.  Rage can be useful, but chronic anger becomes a crutch.",2020PoliceBrutality,How do you cope with the emotions of subscribing to this sub? [2020PoliceBrutality],StuckAtHomeCorona,2020-07-12 23:25,0
34,"Well the reason I get so angry is I actually have a degree in criminal justice that I was going to use to become an officer and parlay that into law school assistance and try to better the system from the inside as at the time I believed it was a few bad ones.(I know naive) However I was disabled in an auto accident before I became able to join. So to me it's almost personal, like showing up to meet the inlaws at xmas and finding a Klan rally instead of sweaters and decorations. As for not being consumed by the hate....it's hard. I find myself having to be mindful  that unadulterated blanket hatred and bloody-minded revenge make me the same as they are and that is unacceptable. I wouldn't say I am jaded by it surprisingly, every article and video is a fresh wound but I feel the very least I am obligated to do as a human being is to bear witness regardless, as they suffer far more than I.",2020PoliceBrutality,How do you cope with the emotions of subscribing to this sub? [2020PoliceBrutality],seraphsrage,2020-07-13 0:02,1
35,Yeah I have a close circle of friends I smoke/make music with and we discuss these issues a lot. We're very open and comfortable with each other so it's a great social safety net for all of us,2020PoliceBrutality,How do you cope with the emotions of subscribing to this sub? [2020PoliceBrutality],berry00,2020-07-18 18:49,1
36,"I have Chronic pain too so I feel you on that. Usually I just repeat a mantra and I sort of center my mind that way. The normal ""just sit and wait"" doesn't work for me because all I can think of is my physical pain. I already do volunteer work in my neighborhood, so I guess it's not completely helpful if you don't already have a goal in mind. Maybe looking up what you can do in your area that is possible with your pain will help with that. I feel that at least knowing you're doing at least *something*, however small, can help with the sort of hopeless feeling that comes from watching these videos. It doesn't completely erase them, but it helps. Even just something as small as being the one who calls and emails your representative, or reaching out to those in your neighborhood who may be hurting at this time thru phone or text. As someone who also has Chronic pain, I feel like that also helps with the isolation we often face because of having limited movement and such, which can make dealing with these things a lot harder because we feel so inactive and hopeless in these situations (not everyone, but some people).",2020PoliceBrutality,How do you cope with the emotions of subscribing to this sub? [2020PoliceBrutality],SailorSunBear,2020-07-25 13:04,0
37,"Oh yeah, it's more numb. than anything. But for me it's not pacifying, if anything this numbness is hardening something inside me. I'm radicalized as fuck, I'll never forgive these people for what they've done to us.   And sorta, I have a bunch of connections with different people so I can roll with a few different folks depending on who is out there. Most of my friends are either too scared or have moved out of town :(.",2020PoliceBrutality,How do you cope with the emotions of subscribing to this sub? [2020PoliceBrutality],,2020-07-31 9:05,1
38,"Haha, I legit did not even notice this wasn't a new post.  I'm really glad you posted about the march and burning out.  It's so helpful to feel less alone in the middle of chaos.   Yes, I agree about Trump waking people up.  He is really exposing so much about America that we have ignored for too long, so I guess that's a silver lining!""We"" is just me and my husband.  I feel like we have been so lock-step in this, it's been hard to tease us apart as far as sharing info and learning together, and now keeping each other motivated/getting ready for DC.  It has been a real blessing to have so much support inside my house when the whole world outside feels like it is burning.",2020PoliceBrutality,How do you cope with the emotions of subscribing to this sub? [2020PoliceBrutality],EarnestHemingweed,2020-08-07 7:48,1
39,"Thanks,I've been considering it for months, I spoke to my wife, who is very supportive, and we decided it's now or never. I'm so sick of people being treated like shit and losing their rights.",2020PoliceBrutality,How do you cope with the emotions of subscribing to this sub? [2020PoliceBrutality],PatrickWynne,2020-08-26 3:19,0
40,I dig this suggestion. And thanks for another mod addition. I do feel like I understand the issue. I've experienced the tyranny of cops in the past over having to go to trial to defend against assault and battery on a police officer. Another time I lucked out and a court employee overheard the cop admitting to purgery in the court halls and snitched on him. I also feel like I am working as hard as I can to be a person like you who can commit to giving offer of my time to a cause without getting burnt out or overextending. I hope to get there one dayDid you have any meaningful experiences which you feel helped prepare you for being a mod for a sub like this?(This question is for any mod if you're reading),2020PoliceBrutality,How do you cope with the emotions of subscribing to this sub? [2020PoliceBrutality],lunar_limbo,2020-07-13 5:46,1
41,Fuck. That would be personal. Over been in chronic pain hell for a huge part of my life and I am scrambling so hard to get healthy enough to do something meaningful. But as I push my body I also put a lot of energy into helping others stand up and find resolve so we can add more humans to these causes. Have you found a new way to act after the accident?,2020PoliceBrutality,How do you cope with the emotions of subscribing to this sub? [2020PoliceBrutality],lunar_limbo,2020-07-13 2:06,1
42,"Glad you have people to roll with. Even if they aren't your closest friends. I also feel a sense of that hardening. While I have been near protests, I'm currently in the South and spending time with an uncle who is the epitome of a deranged Trump supporter and taking with him about the world shows me just how much there are people you can never change, and the only way to stop them is to win, not win them over. But something I'll never change is showing him kindness and empathy. That is my purpose in this life, but I feel tested on that front too. You say friends have moved, do you mean they moved because of the protests?",2020PoliceBrutality,How do you cope with the emotions of subscribing to this sub? [2020PoliceBrutality],lunar_limbo,2020-07-31 13:29,1
43,haha. that difficulty with stickied posts. I am physically disabled and am working very hard to get ready to go to DC. I hope I get everything ready in time. Travel is a huge deal for me. Be safe and prepared!,2020PoliceBrutality,How do you cope with the emotions of subscribing to this sub? [2020PoliceBrutality],lunar_limbo,2020-08-07 17:30,1
44,"I hope you find the grit to try again. It helped me to focus on how gross it was and how much healthier I will feel after. Both things are true and I save money. I know this is unsolicited but another thing is only smoking for enjoyment, not for stress. If you can't stop can down and really enjoy the cigarette then why do it? Make time to enjoy it. That also helped me cut back. Anyway. ♥️",2020PoliceBrutality,How do you cope with the emotions of subscribing to this sub? [2020PoliceBrutality],lunar_limbo,2020-09-14 13:40,1
