,text,subreddit,title,author,created,topic_BLM
1461,"“Hey I’m calling my boss right now... just hold on”* calls 911*“What’s your emergency”“Hey boss. I got two people holding guns on me at our convenience store on first street. They are mad about the incident last week, could you come over ASAP. How fast do you think you can get here? They want you pretty quick it would seem....”",ActualPublicFreakouts,Virginia black panthers harass a convenience store manager,WaltKerman,2020-09-17 19:50,0
1462,"""If you allow yourself to be disarmed you deserve everything that comes after"". Guy gets disarmed at gunpoint surrounded by 10 armed dudes and you say that means he deserves what he gets after that?What a shitty take.",ActualPublicFreakouts,Virginia black panthers harass a convenience store manager,GeorgioArmani2238,2020-09-17 16:32,0
1463,No. When you are outnumbered 4-6 to 1 you apologize no matter what and you do whatever you think gets you home safely.,ActualPublicFreakouts,Virginia black panthers harass a convenience store manager,Joker4U2C,2020-09-17 17:01,0
1464,Fuck that you come into my store like that I would never disarm and let them take that gun away from me. They didn’t come in there to hurt him they came in there to verbally abuse him.,ActualPublicFreakouts,Virginia black panthers harass a convenience store manager,JcruzRD,2020-09-17 8:33,0
1465,Shut the fuck up IDIOT before I rip out my gatling gun and mow you down! I bet you dont even go to the fucking gym every afternoon like I DO. Don't ever call someone a keyboard warrior ever again because you never know what types of MONSTERS we are. We can demolish you.,ActualPublicFreakouts,Virginia black panthers harass a convenience store manager,The-Almighty-Pizza,2020-09-17 8:18,0
1466,"You die first, get it? Your friends might get me in a rush, but not before I make your head into a canoe, you understand me?",ActualPublicFreakouts,Virginia black panthers harass a convenience store manager,illusum,2020-09-17 19:17,1
1467,he is street smart and probably comes from a country where life is cheap and mob mentality rules.. he diligently apologizes and cooperates but you gotta be damn sure he called 911 the second he got off the loti wanna see THAT video,ActualPublicFreakouts,Virginia black panthers harass a convenience store manager,punannimaster,2020-09-17 5:04,0
1468,True. I’m having a hard time with feeling like I’m judging a group of people for the actions of a majority of entitled asshats.I don’t even know what to think anymore.,ActualPublicFreakouts,Virginia black panthers harass a convenience store manager,Demonseedii,2020-09-17 19:18,0
1469,When they tell him to call his boss I was thinking call 911 and pretend your talking to your boss a 911 dispatcher will get the hint and realize your being held hostage and police will show up in force.,ActualPublicFreakouts,Virginia black panthers harass a convenience store manager,Hailhydra775,2020-09-17 7:17,0
1470,Call the “manager” and say hey man I’m at branch (this location) can you come over I need to lock up. It’s urgent,ActualPublicFreakouts,Virginia black panthers harass a convenience store manager,GhostFryes,2020-09-17 9:10,0
1471,"I don’t want to make any assumptions but is it possible he didn’t call the police because he is not here legally? I feel like that’s one of the awful things about our country, if you aren’t here in a specific way, then calling for help will get you kicked out",ActualPublicFreakouts,Virginia black panthers harass a convenience store manager,centurii,2020-09-17 5:38,1
1472,"I’ve been to those kind of court ordered classes (mine was for drugs, not anger) and 100% everyone in there is talking about how stupid the class is and how they can’t wait to get back to business as usual",ActualPublicFreakouts,Gang of teens beat up and kill 59 year-old white man after he refused to give them $1. Today one of the teenagers officially got away with it with nothing more than probation and anger-management classes,shaggy1452,2020-08-19 5:11,1
1473,"It is only a matter of time before the few begin to assemble in seclusion and prepare. * spelling edit I don't know how to strike it in my phone but I spelled it ""prepair.""In the midst of chaos, there is also opportunity. ~ Sun-Tsu",ActualPublicFreakouts,Gang of teens beat up and kill 59 year-old white man after he refused to give them $1. Today one of the teenagers officially got away with it with nothing more than probation and anger-management classes,GBRB1G,2020-08-19 6:12,0
1474,I'm no American but aren't your cops killing innocent pretty regularly and getting away?Just asking I think it shouldn't be something new.,ActualPublicFreakouts,Gang of teens beat up and kill 59 year-old white man after he refused to give them $1. Today one of the teenagers officially got away with it with nothing more than probation and anger-management classes,bubbawears,2020-08-19 13:27,0
1475,"Someone coming up to you has the choice of if and when they're going to strike you. What you think is a down-on-his-luck panhandler could be someone measuring you for an opportunity to beat and rob you. Even if it is 1 in 100 who are willing to go that far, you're not going to know which one it is.",ActualPublicFreakouts,Gang of teens beat up and kill 59 year-old white man after he refused to give them $1. Today one of the teenagers officially got away with it with nothing more than probation and anger-management classes,Baerenmarder,2020-08-19 14:25,0
1476,Wow I heard this as funding for NPR but never new what it actually was. Guess I'll stop paying taxes now.,ActualPublicFreakouts,Gang of teens beat up and kill 59 year-old white man after he refused to give them $1. Today one of the teenagers officially got away with it with nothing more than probation and anger-management classes,silent_erection,2020-08-19 1:43,0
1477,"It doesn't matter if you're a minor.  I don't know a single teenager who doesn't know murder and assault are wrong.  I also don't know a single teenager I grew up with that acted like this and actually got their life together.  Once a worthless human, always a worthless human.  The whole ""everyone can be forgiven"" bullshit is a joke.  Shitty people are shitty and don't deserve to be forgiven.",ActualPublicFreakouts,Gang of teens beat up and kill 59 year-old white man after he refused to give them $1. Today one of the teenagers officially got away with it with nothing more than probation and anger-management classes,TNBroda,2020-08-19 5:46,1
1478,>I still think as a minor he should get a path to forgivenessFuck. That.They *killed* a person. You automatically forfeit your right to live if you take someone else's life.,ActualPublicFreakouts,Gang of teens beat up and kill 59 year-old white man after he refused to give them $1. Today one of the teenagers officially got away with it with nothing more than probation and anger-management classes,PM_TITS_FOR_KITTENS,2020-08-19 14:12,1
1479,"Don’t encourage stealing and intimidation though? There are other ways to ask for money, it sounds like you got straight up robbed lmao",ActualPublicFreakouts,Gang of teens beat up and kill 59 year-old white man after he refused to give them $1. Today one of the teenagers officially got away with it with nothing more than probation and anger-management classes,trenlr911,2020-08-19 7:59,0
1480,I have never had to brandish but when I started carrying it made a difference. 99% of them are just looking to get a few bucks and flex on people because they are assholes but dont intend to fight. If you have confidence and posture correctly they can read the room and will move on without getting in your face. Thing is I wouldnt be brave enough to do this unarmed because if they call your bluff it could turn out bad.,ActualPublicFreakouts,Gang of teens beat up and kill 59 year-old white man after he refused to give them $1. Today one of the teenagers officially got away with it with nothing more than probation and anger-management classes,Puzzleheaded_Seat_44,2020-08-19 13:44,0
1481,"Exactly. Human bodied are strange as well, sometimes one punch can equal death or mental debilitation. Everyone needs to have their guard up.",ActualPublicFreakouts,Gang of teens beat up and kill 59 year-old white man after he refused to give them $1. Today one of the teenagers officially got away with it with nothing more than probation and anger-management classes,Puzzleheaded_Seat_44,2020-08-19 14:28,0
1482,The type im talking about are just like this and they are never homeless. They are assholes that shake people down for money and enjoy intimidating people. Most likely they live off drug dealing and welfare on top of their shake down money.,ActualPublicFreakouts,Gang of teens beat up and kill 59 year-old white man after he refused to give them $1. Today one of the teenagers officially got away with it with nothing more than probation and anger-management classes,Puzzleheaded_Seat_44,2020-08-20 13:56,1
1483,">Once a worthless human, always a worthless human. The whole ""everyone can be forgiven"" bullshit is a joke. Shitty people are shitty and don't deserve to be forgiven. This is the most close-minded shit I've read this week. Not everyone is able to be ""fixed"", but denying people the potential of improving their lives because you see people in black and white is shitty.",ActualPublicFreakouts,Gang of teens beat up and kill 59 year-old white man after he refused to give them $1. Today one of the teenagers officially got away with it with nothing more than probation and anger-management classes,Yelov,2020-08-20 3:18,1
1484,Yep. You can ruin an entire family's life and completely end someone elses... then you get to act like a tough guy with a bunch of other kids by clanging meal trays against walls and rubbing shit on the doors for three years.,ActualPublicFreakouts,Gang of teens beat up and kill 59 year-old white man after he refused to give them $1. Today one of the teenagers officially got away with it with nothing more than probation and anger-management classes,Phazon2000,2020-08-19 5:13,1
1485,"Yo I don't have my headphones rn, I can't blast this in public, and it's gonna take me a while to get home.    Can you/anyone please provide the context?",ActualPublicFreakouts,Gang of teens beat up and kill 59 year-old white man after he refused to give them $1. Today one of the teenagers officially got away with it with nothing more than probation and anger-management classes,SFM61319,2020-08-19 4:48,0
1486,"Life was not shitty in Rome, that is how they grew their empire, those they conquered were happier with the Roman way of life.",ActualPublicFreakouts,Gang of teens beat up and kill 59 year-old white man after he refused to give them $1. Today one of the teenagers officially got away with it with nothing more than probation and anger-management classes,Highroller64,2020-08-19 4:50,0
1487,In this hypothetical situation I can almost guarantee that if the white youths didn't receive any jail time there would probably have been some sort of protest,ActualPublicFreakouts,Gang of teens beat up and kill 59 year-old white man after he refused to give them $1. Today one of the teenagers officially got away with it with nothing more than probation and anger-management classes,Bay12Please,2020-08-19 8:18,0
1488,Because they would have to admit they were wrong.  That's just about the whole damn thing.  They would rather people experience physical pain and trauma through their whole lives than be inconvenienced by the truth.,ActualPublicFreakouts,Gang of teens beat up and kill 59 year-old white man after he refused to give them $1. Today one of the teenagers officially got away with it with nothing more than probation and anger-management classes,G3n3ral13,2020-08-19 14:42,0
1489,I feel like you're forgetting the part where she whipped out a baton when the person told her to go back to the main protest and then pepper sprayed like 5 of them,ActualPublicFreakouts,Gang of teens beat up and kill 59 year-old white man after he refused to give them $1. Today one of the teenagers officially got away with it with nothing more than probation and anger-management classes,willmaster123,2020-08-19 8:25,1
1490,As long as you recognize then that's fine. I just hate seeing otherwise seemingly good people fall into the race trap.,ActualPublicFreakouts,Gang of teens beat up and kill 59 year-old white man after he refused to give them $1. Today one of the teenagers officially got away with it with nothing more than probation and anger-management classes,Butterfriedbacon,2020-08-19 4:17,0
1491,"Man, I really just appreciate the customer service skill set being displayed here. Getting harassed to all hell and depersonalizes the extremely personal interaction to keep helping other customers. This person deserves a promotion into some kind of customer service training role.",ActualPublicFreakouts,Manager bans transphobe for asking for a refund,P00ters,2020-08-11 3:27,1
1492,"Yea, and the fact that they are working for minimum probably? It would had been worth it to start something imo and go apply to Mcy Ds later.",ActualPublicFreakouts,Manager bans transphobe for asking for a refund,tint_farts_matter,2020-08-11 3:42,1
1493,That's perfectly fair but it will never be good enough for the woke crowd. Obey or die is becoming more common.,ActualPublicFreakouts,Manager bans transphobe for asking for a refund,Akhaian,2020-08-11 7:37,0
1494,For real. I have people working under me that make three times or more what this person is likely making in customer service oriented roles and most of them probably would’ve still lost their self control in this situation. I just got done vetting some deescalation courseware as part of remediation and this is the type of person who could make bank leading something like that.,ActualPublicFreakouts,Manager bans transphobe for asking for a refund,P00ters,2020-08-11 4:12,1
1495,"Honest question, how many trans people do you think this therapist has met in person? Follow up question, wouldnt anyone they meet/talk with already be dealing with trauma whether they are trans or not? Isnt that the whole reason you go to a therapist? So of course they wouldnt meet any mentally stable trans people because they have no reason to see them. It makes as much sense as a doctor saying all bikers break bones every time, because he has only seen people who ride bikes and breaks bones.",ActualPublicFreakouts,Manager bans transphobe for asking for a refund,TransVictoriaGlory,2020-08-16 20:53,1
1496,Am I a bad person to hope for the virus to get her so she can shut the fuck up already? I probably am but there's no other way this bitch is gonna shut the fuck up.,ActualPublicFreakouts,"Entitled woman refuses to wear a mask at Ohio EPA check. Asks to speak to manager. Yes it's HER AGAIN. She evokes Jesus to ""command"" them to check her car.",ToshDaBoss,2020-08-11 1:47,0
1497,lmao just say you have a medical exemption. They can't legally ask you about it or force you out without risking a lawsuit as per the ADA,ActualPublicFreakouts,"Entitled woman refuses to wear a mask at Ohio EPA check. Asks to speak to manager. Yes it's HER AGAIN. She evokes Jesus to ""command"" them to check her car.",QUEEFSUPREME,2020-08-09 23:15,0
1498,her facebook shows a LOT of previous employers and no current one. I'm pretty sure shes a full time activist right now,ActualPublicFreakouts,"Entitled woman refuses to wear a mask at Ohio EPA check. Asks to speak to manager. Yes it's HER AGAIN. She evokes Jesus to ""command"" them to check her car.",dvdchris,2020-08-10 3:46,1
1499,Especially yelling at customer service people over small things. This is textbook Karen.  Hopefully the Karen meme will die soon because my aunt Karen is the most chill lady ever.,ActualPublicFreakouts,Classic Karen screams at manager,911sandLSs,2020-07-12 19:46,1
1500,The best part of you ran down the crack of your mama's ass when she squirted you out into this world.,ActualPublicFreakouts,Classic Karen screams at manager,MayorOfMonkeyIsland,2020-07-10 20:43,1
1501,This is the Toronto Humane Society. They work very hard there. I adopted a dog from this location and I have nothing but positive things to say about them. This lady doesn't even know if its real fur or not. The guy in the vid is really great and helped me with my dog. He handled this very well,ActualPublicFreakouts,Animal Rights Karen Komplains about Fur Trim on Jacket to Animal Rescuers Management Office,jo_thequeen,2020-07-04 12:57,1
1502,"Finally a video where the protagonist does everything exactly as they should.  Gave me a lot of satisfaction. ""No ill take that for her."" ""No,.you can't come in here"". ""You need to leave"". That bitch couldn't do anything.",ActualPublicFreakouts,Animal Rights Karen Komplains about Fur Trim on Jacket to Animal Rescuers Management Office,missingnuts27,2020-07-04 6:52,0
1503,Amazing how we live in a  time where any crazy person can pull out their cellphone and record themselves doing something stupid.,ActualPublicFreakouts,Animal Rights Karen Komplains about Fur Trim on Jacket to Animal Rescuers Management Office,TheMenloMagic95,2020-07-04 19:14,1
1504,"Rich kids grown up living life as a disney movie don't understand this. They hear ""You don't work for money you work towards what you love doing and then it isn't work!"" and think everyone can do this when that only applies to maybe 5% of people. The rest of us have to work a job, and make something up that sounds good at an interview when they ask ""Why do you want to work here?"" because everyone in reality knows the answer is money.",ActualPublicFreakouts,Animal Rights Karen Komplains about Fur Trim on Jacket to Animal Rescuers Management Office,AKA_AmbulanceDriver,2020-07-04 13:10,1
1505,"Because not buying a fur coat leaves one more fur coat on the shelf, so one less animal needs to be killed to get that coat.  It's basic supply and demand.  If fur was illegal in their state and it was just surplus, that would be a different story.",ActualPublicFreakouts,Animal Rights Karen Komplains about Fur Trim on Jacket to Animal Rescuers Management Office,BunnyLovr,2020-07-04 1:08,1
1506,"Ngl, it would have been fine to offer a suggestion and respect if they disagree but she decided to up the hysterics",ActualPublicFreakouts,Animal Rights Karen Komplains about Fur Trim on Jacket to Animal Rescuers Management Office,dramasutra2020,2020-07-03 19:45,0
1507,"I 100% agree with the overlap you point out. We need to have some separation of category. I think she would have needed some type of permission from the front desk to go into that office, it didn’t come off as barging in and more like walking in with a preconceived narrative to talk at people with.Are Karen’s more entitled and self imposing of their beliefs than PETA?",ActualPublicFreakouts,Animal Rights Karen Komplains about Fur Trim on Jacket to Animal Rescuers Management Office,bryyyyyyyyyyy,2020-07-03 20:02,1
1508,"Why would she face charges? She easily could have feared for her life. One lady, alone in a car while crazies yell at her and try to force her out. Protest all you want, 24 hours a day, 7 days a week, but stay out of the fucking road. Some of us have jobs and other obligations to fill.",ActualPublicFreakouts,"Woman drives through BLM protest in Pennsylvania, city manager effectively said she would not face charges",upinthemountains42,2020-06-09 4:45,0
1509,"Get a job? How dare you suggest they take responsibility for their own lives and put in the effort to improve their situation! It is all someone else's fault, not sure who specifically, just not theirs",ActualPublicFreakouts,"Woman drives through BLM protest in Pennsylvania, city manager effectively said she would not face charges",Totalaids,2020-06-09 16:07,0
1510,Walmart is the biggest welfare queen in this country. People laid off or at home due to quarantine arent the problem,ActualPublicFreakouts,"Woman drives through BLM protest in Pennsylvania, city manager effectively said she would not face charges",bitches_be,2020-06-09 20:52,0
1511,"If they don't care about my needs, then I don't care about theirs.   Good luck writing history when you've alienated everyone around you.",ActualPublicFreakouts,"Woman drives through BLM protest in Pennsylvania, city manager effectively said she would not face charges",nostracannibus,2020-06-09 17:30,1
1512,"Every day I think that I have seen dumbest fuck ever, with their 'headline level subject knowledge' exposing their  woke-tardation .  And another you comes along.",ActualPublicFreakouts,"Woman drives through BLM protest in Pennsylvania, city manager effectively said she would not face charges",gram2017,2020-06-09 13:27,0
1513,"What are you talking about, I was addressing his point that their commies because they don’t work but the unemployment rate is wavering between 15-25%.",ActualPublicFreakouts,"Woman drives through BLM protest in Pennsylvania, city manager effectively said she would not face charges",Seigeius,2020-06-09 1:31,1
1514,"You realise you don't persuade anyone to your point of view by spewing baseless hate, right?> likely Do you have some stats there? Sounds to me like you're taking an incident and using it to spread fear and hate.I'm sorry your life is so driven by hate towards others. You should know most people are happy and don't have your issues.",ActualPublicFreakouts,"Woman drives through BLM protest in Pennsylvania, city manager effectively said she would not face charges",maest,2020-06-09 15:32,1
1515,"Where else on the planet have people been run over by Islamic terrorists in delivery vans?Believe it or not, what you see on the dramatic American MSM isn't a good indicator as to how things actually are here.",ActualPublicFreakouts,"Woman drives through BLM protest in Pennsylvania, city manager effectively said she would not face charges",MrSilk13642,2020-06-09 16:28,0
1516,what is up with her asking for a manager to complain about another customer?  what is the manager going to do? they don't work for them and aren't their mom. someone is use to getting her way and doesn't like being called on her shit.,ActualPublicFreakouts,Karen wants the manager...,glucoseintolerant,2020-06-04 17:41,1
1517,"Tell you what, I'm more than a keyboard warrior if you ever want to meet up!!!How about you shame karen for being karen and leave her body alone.",ActualPublicFreakouts,Karen wants the manager...,jadedbyhypocrisy,2020-06-04 19:20,0
1518,I think some people are forgetting that everyone is still human at the end of the day. Kudos to that brave woman.,ActualPublicFreakouts,Protester manages to stop some looters,Naticus_55,2020-06-02 20:32,0
1519,"She is so amazingly brave. I really hope everything goes well for her in her life. Protesting is one thing but this looting shit gotta stop, it’s wack as fuck.",ActualPublicFreakouts,Protester manages to stop some looters,jasonml,2020-06-03 9:41,0
1520,"""Some kind of weapon"" = a tool - and in this case a hammer. No wonder people don't trust the news (these days). Good job by the protester though, stop these idiots...",ActualPublicFreakouts,Protester manages to stop some looters,anderleysh,2020-06-03 14:16,0
1521,"This is the only time I’m dropping my motto of “equal rights equal fights” because this is the only damn person I’ve seen using her abilities as a woman for good rather than evil. Good on her, we need more like her.",ActualPublicFreakouts,Protester manages to stop some looters,SneakyEnch,2020-06-03 14:37,0
1522,"The employees would support this notion, they get every day paid when the building is shut down due to outside forces.",ActualPublicFreakouts,Protester manages to stop some looters,bjarke-,2020-06-03 0:18,0
1523,"Anything you can resell is fair game. Tents and hiking gear is very expensive, you could make a killing reselling it on ebay or FB marketplace.",ActualPublicFreakouts,Protester manages to stop some looters,Real_Mila_Kunis,2020-06-03 17:22,0
1524,"Mate, it's a can. Spinal damage jesus christ, do you wrap yourself up in bubblewrap before you leave the house? Shouldn't have thrown in it but you're being incredibly dramatic.",ActualPublicFreakouts,Protester manages to stop some looters,_YouMadeMeDoItReddit,2020-06-03 14:44,0
1525,Are you anti Obama cause him being president didn't end racism? I really dont feel like its fair to put that on him dude,ActualPublicFreakouts,Protester manages to stop some looters,brobo-baggins,2020-06-09 13:07,0
1526,Are you saying if there would've been nationwide protesting every day for weeks there wouldn't be any change? They didn't even try that. Straight to looting and rioting on day one. We'll see how that works. I think it's going to be shut down inside a week.,ActualPublicFreakouts,Protester manages to stop some looters,dblist,2020-06-03 22:20,0
1527,"So you admit you're projecting your worldview onto these people without any evidence? We are making progress. Rich people steal all the time and they pay taxes. Shoplift, even. Do you know the person in the video's identity? Do you know his net worth, job, or tax information? You're advocating for the death of these people for minor property damage and some other background bullshit you just made up without evidence? Do you even understand why I'm pressing you on this?",ActualPublicFreakouts,Protester manages to stop some looters,Ohhhhhkeeeepaaaaa,2020-06-03 0:23,1
1528,This  monster lady is actually kind of funny but I feel bad for the picnic people.  And the 'speak to the manager' line? GOLD GOLD GOLD,ActualPublicFreakouts,"“Donald Trump says GO HOME.” Drunk woman harasses Puerto Rican family for enjoying music while barbecuing. They ask her if she wants to speak to the manager. “Ok, Karen, bye.”",Notorious_VSG,2020-05-30 3:26,1
