,text,subreddit,title,author,created,topic_BLM
465,"Yeah, the forty-YOs will survive the virus, but their children might not survive *poverty*, in such a third-world country as the US has become. Not surprising, you are leaving your poor behind - sacrificing them to protect the wealthy boomer generation. Effectively you are primarily protecting the *dying ones*: ""Dying"" in the sense that those who die from other causes *first,* won't contract the virus. If the prognoses are right that most of us will contract it sooner or later, then you are letting poor children starve so that wealthy dying boomers shall have time to die from something else first. * Poor 40-yo's who have lost their jobs, no longer have an income (unlike on my side of the Atlantic, where social insurance could grant them like $2/month and up) - and they never had wealth. They - and the children they have to feed - are sacrificed to protect wealthy boomers. * Poor 40-yo's who have lost their jobs, no longer have healthcare (again, unlike in a proper welfare state). They - and the children that were covered by their now-expired insurance plans - are sacrificed to protect wealthy boomers.Had you had a proper taxation in place, the greater tax burden would have fallen on  people like myself - who are still making money and even have some in the bank. And had you had a proper healthcare system in place, the hospitals wouldn't furlough nurses who aren't working in the ICUs (I mean, who should they be caring for? Those who have lost their jobs and no longer have healthcare?).",ABoringDystopia,"Walmart with their new staff uniforms, this is an image from a manager",CainPillar,2020-05-10 2:46,1
466,"With 80K deaths and plenty of people exposing themselves being forced to work, it isn't that hard to imagine that retail workers have gotten sick and died. What exactly are you getting at, anyway? Have you forgotten that people are dying? Is the shirt better if 0 walmart workers died? Do you have a point?",ABoringDystopia,"Walmart with their new staff uniforms, this is an image from a manager",mrfloopa,2020-05-09 22:16,1
467,"Oof, I don't really keep up with America too much, too depressing for me. Not like the UKs any better atm haha.",ABoringDystopia,"Walmart with their new staff uniforms, this is an image from a manager",TheDevilsTrinket,2020-05-09 21:06,0
468,Good luck fighting Walmart lawyers when the CEO of Walmart is at the White House rose garden every month fellating the orange pile of shit that got us into this mess,ABoringDystopia,"Walmart with their new staff uniforms, this is an image from a manager",Elyon113,2020-05-09 18:15,0
469,I’m an “essential” worker. I a manager at a pizza place and I have had my hours cut slightly but still working. I am unable to receive the stimulus check and unemployment. I am not getting hazard pay even tho I expose myself every shift. I feel as tho I am the forgotten group. I am unable to get the stimulus due to being claimed on taxes by my parents. This was because this time last year I was a full time student and only a part time worker. So since I was claimed I am unable to receive the stimulus payment. And since my hours are only slightly cut I can’t file for unemployment. I feel as tho I am doing the most work and receiving the least amount of benefits. What a boring dystopia this is.,ABoringDystopia,Essential workers not recognized,Dlbrando6,2020-04-23 9:33,1
470,I feel ya bro. There are 4 confirmed cases at the company I work for. Still no hazard pay and anyone who makes more than me gets to work from home.,ABoringDystopia,Essential workers not recognized,Aray171717,2020-04-23 9:35,1
471,My front of house coworkers are on employment making double what I make a week. I wish I could honestly get laid off to get paid unemployment for a few months. Would definitely help my mental not working as much plus add on working during a pandemic.,ABoringDystopia,Essential workers not recognized,Dlbrando6,2020-04-23 9:38,1
472,Doesn’t matter how much you work if you lose a certain amount of hours you qualify for some unemployment. My main issue is those losing theirs jobs and staying home with zero risk are being paid double what I am for staying and risking getting infected. Just simple math not adding up for those who are basically business as usual. Overtime and 1.5 pay is a thing when you pass 40 hours but working during a global pandemic gets you a good ole thumbs ups and a hang in there.,ABoringDystopia,Essential workers not recognized,Dlbrando6,2020-04-24 6:54,0
473,"Hi everyone! I’m 18 years old and facing layoffs from my company. I got my first ever warning and final warning for mentioning to my coworkers about forming a union and going on strike. I work at a company which rhymes with Umberland Arms, we are provided very little equipment to protect ourselves from Covid-19 and are not allowed to enforce company policies when it comes down to it. I’ve been talking to my coworkers about forming a union and going on strike for more equipment and better training and handling of this outbreak. But just yesterday after my manager heard wind of this issued me a final warning saying any new mention of a union or a strike would get me laided off and the company would contest any form of unemployment. So this is slowly turning more into a Dystopia then a boring one",ABoringDystopia,I got a final warning from work due to mentioning forming a union.,TheGayVal2001,2020-04-17 4:05,0
474,"So stop mentioning it. Seriously. Just keep your head down and do the job you agreed to do for the pennies they toss you. Who the fuck do you think you are asking for a living wage, work that adds meaning to your life, and the chance to organize with your fellow wage slaves? Fucking whatever they he’ll comes after millennials... /s (sucks I gotta add the /s but you never know...)",ABoringDystopia,I got a final warning from work due to mentioning forming a union.,alwaysZenryoku,2020-04-17 11:37,0
475,A guy tries to help and you shit on it? How much is that manager making 40k a year. What a fucking monster. Should have just gave them a kick in the ass and asid good luck.,ABoringDystopia,Manager set up a $50 junk food pantry for his starving workforce.,LockPickingPilot,2020-04-10 10:05,1
476,Having to rely on generosity of your entreprise to not starve during a pandemic instead of having a universal income lmao.,ABoringDystopia,Manager set up a $50 junk food pantry for his starving workforce.,Ghazgkhull,2020-04-10 10:09,0
477,">he’s literally doing it so his workers don’t need to spend their own money on food by providing it for them. No one is saying they’re not paid enough.I mean it's right there in the headline: ""to ensure that nobody has to worry about being able to pay for groceries during the major cuts in shifts recently"".>Imagine getting angryI'm not, you're projecting. Feels like you're deliberately missing the point so you can defend the management when you can't defend the situation. Sorry for ruining you perseverance porn, I guess.",ABoringDystopia,Manager set up a $50 junk food pantry for his starving workforce.,JagKissarIDuschen,2020-04-10 11:19,1
478,"""Situation"" being the operative word here. You accused me of getting angry at the manager:>Imagine **getting angry when he’s** literally doing it so his workers don’t need to spend their own money on food by providing it for them.But I'll guess you just keep deliberately missing the point so you can be angry at me for ""attacking the manager"" instead of having to come to terms with the shitty reality that many America workers live in.",ABoringDystopia,Manager set up a $50 junk food pantry for his starving workforce.,JagKissarIDuschen,2020-04-10 12:17,1
479,"ngl, I read it as 'the manager here,' and thought this was a confession. Took too long to work it out.",ABoringDystopia,The trashy manager,porcelain_platypus,2020-04-10 19:33,1
480,Damn now Veggietales is going broke too. How will they survive now they criticised the dear leader and lost their evangelical customers?,ABoringDystopia,And yet they manage our life,Dawk320,2020-03-24 8:53,0
481,Why can’t we just let the free market decide what happens to them? Why does the free market affect small businesses and the working class?,ABoringDystopia,And yet they manage our life,Andy_LaVolpe,2020-03-24 9:27,1
482,"People should have the saving when they experience problems (lost jobs, emergencies...), not for pandemic related issues. If key companies are bailed out, people should also be bailed out.",ABoringDystopia,And yet they manage our life,Zifnab_palmesano,2020-03-24 15:16,0
483,"I was just talking about with my parents (via video chat) the other day.  Like, I have a little money left each month after bills and necessities to pay down debt, but I'm supposed to have several months of an emergency fund and multi-billion dollar corporations apparently can't handle a few weeks of reduced income.",ABoringDystopia,And yet they manage our life,KingDavid73,2020-03-24 15:59,0
484,"To be clear, a lot of these (but not all) firms are sitting on huge piles of cash. They’re just not willing to spend it on their workers.",ABoringDystopia,And yet they manage our life,djazzie,2020-03-24 12:53,1
485,[Congresswoman asks a CEO how a working single mother should budget her money to make it last to the end of the month.](https://www.youtube.com/watch?v=2WLuuCM6Ej0)His answer will surprise you! /s,ABoringDystopia,And yet they manage our life,sarais,2020-03-24 17:48,1
486,"The IRS penalizes companies for sitting n too much cash in most cases. Look up the “Excess earnings” tax. It’s formulated to force companies to return capital or invest it, so companies generally carry only the bare minimum cash.",ABoringDystopia,And yet they manage our life,benfranklyblog,2020-03-24 14:51,0
487,"I work in McDonald's and a few days ago the executive sent all the employees an email about how despite the reduced profits these past weeks, we have nothing to worry about because they are in an exceptional financial situation and that they can continue to support the workers even with complete work stopagge. I haven't even heard of any billion dollar corporations complaining tbh only the smaller companies",ABoringDystopia,And yet they manage our life,bis-muth,2020-03-24 15:20,0
488,"Cool meme, but not practical and here's why:Business A: responsibly saves 6 mo of operating expenses (thousands of dollars)Business B: instead of saving those thousands of dollars, invests them in expanding its operations.Business B takes over all of Business A's market share and A goes out of business.",ABoringDystopia,And yet they manage our life,justplanefun37,2020-03-24 13:33,0
489,"How many times is the exact same thought going to be posted?Do you guys not realize that no business is designed to function if cash flow stops overnight? By this logic a business should never cut expenses when sales go down.I get it, f*ck the corporations but no matter the size of the business the principles are the same, if they lose all of their revenue they need to slash costs or go under. Yeah, for the evil ""shareholders"", you can be a shareholder to and massive multinational companies going under all at once doesnt help anybody even if it makes liberals feel vindicated.",ABoringDystopia,And yet they manage our life,Landis912,2020-03-24 13:01,0
490,"Let me preface my statement with this: I am in no way intending to blanketly defend corporations. They're disgusting and toxic with how they're currently able to exploit workers to maximize profits and buy politicians so that they can protect amd maximize said exploitation.That said, it would be very detrimental if every company was expected to save enough money to be able to afford payroll and benefits for an indeterminate ammount of time, which is what we're looking at right now. There's no guaranteed timeline right now.Think about how many people are employed by the currently struggling companies. Now think about how much it would cost to pay those enployees' salaries and benefits for, say, three months. That is an insane ammount of money just sitting in a bank account somewhere that could be used for innovation and expansion. The government should be there to bail out companies in a crisis provided the company didnt have a hand in creating the very crisis that they need to be bailed out from. Of course, there should be oversight and strings attatched to that money so that it doesn't result in massive executive bonuses and stock buybacks while also paying off large swathes of their workforce. Rather than attack the companies directly we need to realize that while disgusting and toxic, what they are doing is legal. We need to regulate this behaviour out and increase worker pay. Companies care about one thing, profit. So they will do anything they can to minimize their costs. With proper regulations in place, workers can be guaranteed a livable wage and benefits such as paid time off and retirement(I currently believe we at least need to decouple health insurance from employment and provide a public option to compete with the health insurance companies, but that isn't the current subject).To get there from here, we need to vote out the bought politicians and get ones in that have the moral backbone to pass the legislation that will break the current cycle of massive amounts of dark corporate money in politics.",ABoringDystopia,And yet they manage our life,molotron,2020-03-24 12:36,1
491,"As much as I hate bailouts and bailouts without any restrictions, it’s the same reason we have a social security system.In all reality if I got to keep my social security tax and invest it into my retirement stocks, I’d be able to get back millions by the time I’m retiring age. I do invest and max out my IRA every year but that’s not the point. The point is if I had control over my social security tax I could make EVEN MORE with the return in the stock market. But.Most folks would not do it and don’t plan for it, so the SS program acts  as a Ponzi Scheme, never gaining money but always being replenished by new younger workers paying tax. It’s just a way to help provide for older people so they aren’t left with the choice of homelessness / suicide / worse. It’s just a social program to help those who don’t plan ahead and help boost our economy.In the same way that’s why they bail out corporations. I don’t like it. At all. But that’s how it is. If corporations aren’t bailed out it could result in huge job loss for thousands or millions of Americans and trigger a Great Depression.",ABoringDystopia,And yet they manage our life,INTHEMIDSTOFLIONS,2020-03-24 14:56,1
492,"Its nuts. I understand having an emergency fund, for things like short term emergencies. Your car suddenly needing a repair, for example. But considering how long all this will last and how many people are out of work its actual insanity to expect that average people have 10k+ tucked away for pandemic emergencies where they're out of work for months. It's ridiculous.",ABoringDystopia,And yet they manage our life,BlondeShadow,2020-03-24 16:41,1
493,Conservatives: “wElL what is the DEBT from?! Maybe you should have started saving before you got the debt!! Reee social safety nets reee my dime!”,ABoringDystopia,And yet they manage our life,Xdude199,2020-03-24 21:53,0
494,"> Do you guys not realize that no business is designed to function if cash flow stops overnight?Almost like the economic structure we live in is unsustainable...> By this logic a business should never cut expenses when sales go down.This isn't a critique of how corporations have to behave to survive under capitalism, it's a critique of capitalism.> Yeah, for the evil ""shareholders"", you can be a shareholder to and massive multinational companies going under all at once doesnt help anybody even if it makes liberals feel vindicatedI understand that companies going under all at once is bad for the workers (side note: it's not bad for the rich long-term). That's why a system in which the economy experiences massive constrictions, displaces millions of workers into unemployment/starvation every few years, and requires massive injections of money via taxpayers should be considered a failure and replaced with something functional. Another side note: most of us here aren't liberals, nor do we feel vindicated when workers can't feed their families because of economic crashes. Major shareholders on the other hand should reap what they sow, and feel what it's like for once.",ABoringDystopia,And yet they manage our life,IronyAndWhine,2020-03-24 13:49,1
495,"I work for an old, family business that has been in continuous operation for almost one hundred years, run by the third generation of the family. It's a medium sized manufacturing company in the U.S. They have enough resources set aside in a variety of investments to survive for quite a while under economic turmoil. They own the land, their factories, and most of the equipment outright, unencumbered by any financing.You know what the owners' first response was when we heard the governor of our state shut down all non-essential businesses? They said we will just keep paying all the employees, call it ""sick pay"" and later see if the government reimburses them later through some relief program ... or not.They weren't too worried about it. They didn't even break a sweat.THAT is how good businesses are managed, and the reason they will be around still after this crisis passes. Their most important ""assets"" is all the regular employees who make the business run day in and day out.",ABoringDystopia,And yet they manage our life,brainskan13,2020-03-24 14:03,1
496,So how about they pay their CEO’s slightly less? Or like have stock aside specifically to sell off for this reason? Or a portion on stocks send dividend payments to an account for this reason? Or a hundred other things? With the amount of money that companies take from their employees they should be able to come up with something,ABoringDystopia,And yet they manage our life,FN-2814,2020-03-24 15:56,0
497,"> Now think about how much it would cost to pay those enployees' salaries and benefits for, say, three months. That is an insane ammount of money just sitting in a bank account somewhere that could be used for innovation and expansion.And somehow when it's spread out among the employees it magically becomes not an insane amount of money?",ABoringDystopia,And yet they manage our life,UsingYourWifi,2020-03-24 16:02,0
498,"If these companies were using said capital to invest for the future, that'd be one thing. The reality is that corporate America by and large, has used not just the entirity of their tax cut windfalls to buy back stock, but went a step further and TOOK ON MASSIVE LOADS DEBT because of the low interest rates to buy back EVEN MORE STOCK.This is obviously not the case for small business, but it's absolutely the case for industries like the airlines, who are now lined up with their hands out to socialize their losses, and keep executive bonuses.",ABoringDystopia,And yet they manage our life,3sheets2IT,2020-03-24 16:32,0
499,"If a company needs bailed out by the govt, that company should then be nationalized. No free money for corporate leaches.",ABoringDystopia,And yet they manage our life,sea-god,2020-03-24 16:39,1
500,">It would be very detrimental if every company was expected to save enough money to be able to afford payroll and benefits for an indeterminate ammount of time, which is what we're looking at right now.An indeterminate amount? They're broke 2 weeks in. That seems like a totally reasonable amount of ""emergency fund"" money to have in hand.",ABoringDystopia,And yet they manage our life,Enk1ndle,2020-03-24 16:45,0
501,"But you cant have shareholders reaping what they sow without having millions out of work. And people just focus on the big corporation like American Airlines but what about the airports, the small factories that make the individual parts for planes, the mechanics, the baggage handlers, the fuckin uber drivers that take people to the airport, it's all intertwined, that's what people dont realize when they talk about ""the economy"" we are all the economy.Maybe it would be better if we had 20 small airlines instead of 4 or 5 big ones but how do you keep the small ones from becoming big or merging to grow their market share, it's not possible to prevent. My point is, I understand wanting corporations to get their comeuppance but though it sounds clever to say ""they should have a reserve fund like they tell us"" literally makes no sense when you apply it to the real world. Any reserves they have is money that could be better put to use in the economy growing their business, when people say Amazon pays no taxes its because they invest all of their profits back into the business rather than give half of it to the government, majority of business owners large and small do this. Compensation to executives is still taxed, capital gains are still taxed, sales tax is paid on any purchases made, real estate taxes paid on any property owned, payroll tax paid on every employee that collects a check. They pay plenty in taxes, just at the end of the year they write off all of those(legitimate) costs of doing business and their remaining taxable income at the end of the year is very low. To say how things should be different you need to understand why they are and that's what's lost on all of these people tweeting the same comment over and over like they're clever.",ABoringDystopia,And yet they manage our life,Landis912,2020-03-24 14:06,1
502,"I'm going to reiterate the whole 'I absolutely believe corporations are fucked and fuck over society' thing, but also corporations legally aren't allowed to hold onto their profits. Clearly citizens also shouldn't be expected to have savings of that kind, but companies are required to pay out their profits to shareholders or to invest them back in the company.",ABoringDystopia,And yet they manage our life,sharkattack1011,2020-03-24 13:23,1
503,">THAT is how good businesses are managedIt really isn't. Your talking about a company that has seen a lot of success and is now stable enough that it can absorb a major hit.But if you were trying to start a competing company, and you ran on the assumption that you should be able to survive for a year with 0 revenue, you'd be out-competed by every business not doing that.If you buy your land outright, and I leverage the same amount of capital to buy three times the land you have, I will out-compete you.There are absolutely many corporations that are corrupt and poorly managed, but saying that business are poorly managed if they don't have a war chest to survive with no revenue for a year is just silly.",ABoringDystopia,And yet they manage our life,Siiimo,2020-03-24 19:23,0
504,The point isn't that it's impossible for a company to set up a relief fund for a crisis. There's plenty that could. The point is that money shouldn't be hoarded to that extent period. It's much better for the economy to have that money being circulated through the economy being spent on goods and services.,ABoringDystopia,And yet they manage our life,molotron,2020-03-24 16:16,1
505,"Yeah, because you aren't just looking at payroll. You're looking at every expense that comes along with operating that business. Payroll is only part of the equation.",ABoringDystopia,And yet they manage our life,molotron,2020-03-24 16:12,0
506,"Many bars and restraunts, especially locally owned ones, have pretty thin margins. It doesn't surprise me at all that they're so easily broke. It is surprising that they rely on this weeks revenue to make last weekend's payroll. But that another good point, not necessarily businesses that operate a week behind on expenses, but the fact that businesses exist that just cannot afford to sit on the funds to pay employees in a crisis like this. So even if it were mandated that they do so, that net just cannot exist for the workers at companies like that that exist.",ABoringDystopia,And yet they manage our life,molotron,2020-03-24 17:47,1
507,To am extent. I like the idea Pelosi has that there are certain strings attached to bail out loans that say companies that recieved said loans cannot provide bonuses or participate in stock buybacks until that loan is repaid.,ABoringDystopia,And yet they manage our life,molotron,2020-03-24 16:40,1
508,"Not really, personal finance and corporate finance are two separate monsters. I wont argue that everyone saving 10k doesnt keep a lot of money from circulating in the economy. But how many people need 10k to survive for three months? I'm sure there's some people that need that much, but I don't think the vast majority of Americans need 10k to survive for three months.Edit: The point is, though, that the ammount of money required for every individual to survive for three months isn't close to the ammount required for every corporation to survive and pay its employees for three months. Not only is the scale way off regarding the expenses such as utilities and rent but the individual isn't also giving part of that 10k to someone else.",ABoringDystopia,And yet they manage our life,molotron,2020-03-24 13:30,1
