,text,subreddit,title,author,created,topic_BLM
910,lol journalists.. The NY Post doesn't even pretend to have journalistic integrity. They know full well that they aren't doing any good for the world but rather pushing narratives that will get them and and their friends to retain wealth and power.,ABoringDystopia,Headline for a 17-year-old murderer vs. headline for a 17-year-old victim,Globalist_Nationlist,2020-08-29 17:00,1
911,"The absolutely worst thing about this is that it's always been difficult to leave because the poor don't have the means to emigrate (education, skills, money) and now even the non-poor are stuck here. I **would** leave the US but now they've trapped me here with their irresponsible public health policies. No one wants to admit an American anywhere because I could have the Rona.Guess what, now you're stuck with my whiny progressive socialist ass until I can leave. You're not allowed to just say ""then leave"" any more.",ABoringDystopia,Headline for a 17-year-old murderer vs. headline for a 17-year-old victim,Spaghetti_Barbarian,2020-08-30 6:44,0
912,"I basically think everyone involved is a bad person, from the murderer, to his victims, to the police who don't arrest him when he's surrendering. No-one in this story comes out looking good.",ABoringDystopia,Headline for a 17-year-old murderer vs. headline for a 17-year-old victim,RadicalDog,2020-08-30 0:26,0
913,Yep. And the militia is busy scrubbing social media posts because they had been bragging for days they had found a way to go kill protesters and have a semi valid “excuse” for it.,ABoringDystopia,Headline for a 17-year-old murderer vs. headline for a 17-year-old victim,fyberoptyk,2020-08-29 18:51,0
914,"> Dude was there before shit got nasty. No he absolutely wasn’t, shit has been nasty for a couple days already, which is why he showed up in the first place.  You’re a fucking idiot.",ABoringDystopia,Headline for a 17-year-old murderer vs. headline for a 17-year-old victim,tapthatsap,2020-08-29 19:33,0
915,Oh wow the murderer’s side of the story is that he’s actually a good guy.  Clearly the truth must be somewhere in thehahahahaha,ABoringDystopia,Headline for a 17-year-old murderer vs. headline for a 17-year-old victim,tapthatsap,2020-08-29 19:45,0
916,"Want an inside tip? It's sitting there because they stopped sending multiple trucks out a night, don't train new people, and have actively stopped conversions to career status, while foisting an ever increasing workload onto a small core of workers. What's more, when it does ""let up"" as its starting to, it's only because it's plugged up somewhere else up the line, not any actual fixes",ABoringDystopia,"Where are my USPS packages, Trump?",Heretek1914,2020-08-09 10:01,1
917,"They’re trying to bring down the postal system, then gaslight people into believing it never worked well and was always this shitty and that private services like UPS and fedex are better so they can load their pockets with higher profit margins.Hoping people will know better but with today’s population I really don’t know if I can count on that.",ABoringDystopia,"Where are my USPS packages, Trump?",darkoblivion000,2020-08-09 14:34,0
918,"This is why you always go FedEx or DHL.Some online stores insist on using USPS, but I actually had some success with emailing them to get them to use a different carrier. It works sometimes, I just have to pay a little extra.",ABoringDystopia,"Where are my USPS packages, Trump?",Medical_Officer,2020-08-09 14:36,1
919,">don't train new peopleThat's been a problem for YEARS my dad was a letter carrier for over 40 years, towards the end before he retired, the last 5 years or so he was basically working""mandatory overtime"" 6 days a week because they were so understaffed",ABoringDystopia,"Where are my USPS packages, Trump?",RawrRRitchie,2020-08-09 10:41,0
920,"They still have that. Only recently have a handful of 5 day shifts become available. In most facilities, the OT is being scaled back to slow the mail. But ours, still in full, mandatory effect because of the volume. Despite that, it doesn't actually do much when machines turn off at a certain time and the people left over don't know what they're doing. They refuse to train people, expect us to train them, and when we don't because they refuse to pay us as trainers, we're in the wrong somehow because ""we aren't showing them the ropes,"" which is somehow different than training.",ABoringDystopia,"Where are my USPS packages, Trump?",Heretek1914,2020-08-09 12:57,1
921,Shhhhhh that ruins the narrative that all cops are all bad all the time and can get away with everything. Cause anything less or any justice doesn't fit the story they wanna keep telling,ABoringDystopia,Cops upset cuz they can't murder innocent civilians,the_cuntess21,2020-08-03 2:35,0
922,"Nah, that's the easy way out. She should have gotten life as well as letting all the other inmates know what she did. She wouldn't have it easy after that.",ABoringDystopia,Murder gets you 1 year Having some funny leaves gets you 40,scorpioninashoe,2020-08-02 10:58,0
923,"I wish democrats would stop trying to symbolically dunk on republicans and just fucking listen to what people are asking of them, this shit is exhausting",ABoringDystopia,"“People want real, systemic change to the policing system because they’re constantly being murdered by the police? I know: Let’s troll Trump!”",hippiechan,2020-06-25 18:07,0
924,This is he said/she said. Of course he’s gonna make himself out to be the good guy. I wanna hear the other side of the story before coming to a conclusion on this,ABoringDystopia,"“People want real, systemic change to the policing system because they’re constantly being murdered by the police? I know: Let’s troll Trump!”",oxymoronic_oxygen,2020-06-26 5:01,1
925,"Thank you for being respectful. It's always nice to have a debate that doesn't end up becoming nasty. I also see where you stand on this matter and respect it. Again, thanks for being kind.",ABoringDystopia,HDQ Neutral and modern gas chambers,Hyacinpollo,2020-06-17 21:01,1
926,"That was one of the first things they released here in Texas after Amber Guyger murdered Botham Jean...  ""Small amount of marijuana found in his apartment"" like that had fucking *anything* to do with it.",ABoringDystopia,It’s almost like police gets special treatment for murder,19Kilo,2020-05-31 7:24,0
927,"I never said I wouldn’t want revenge. Of course I would, but that doesn’t mean I should go and get revenge. People acting out on their emotions is what got us into this situation in the first place. You people think your so much more morally superior to the person that hurt you, when in reality your just another person hurting another.",ABoringDystopia,It is forbidden to kill; therefore all murderers are punished unless they kill in large numbers and to the sound of trumpets. - Voltaire,Itzlickinlizards,2020-05-29 18:57,1
928,My family and people I’ve lived near. Multiple things happened in our life making us want revenge on somebody. Looking back now we are all glad we let it go. If we did get revenge we would just be making it worse.,ABoringDystopia,It is forbidden to kill; therefore all murderers are punished unless they kill in large numbers and to the sound of trumpets. - Voltaire,Itzlickinlizards,2020-05-29 23:05,1
929,"Right, the very fact that you felt you wanted revenge ... then when can, you will and when your hands are tied or fear of law, you will not. You were either unable to get revenge or were fearful... but you did not stop because you felt ""nothing to gain from revenge""",ABoringDystopia,It is forbidden to kill; therefore all murderers are punished unless they kill in large numbers and to the sound of trumpets. - Voltaire,gurusviews,2020-05-30 1:24,0
930,"When people ask me why I'm hating on American, along with 12 other things like social division, incarceration rates, privatized prisons and healthcare, poor public transport, I send them this post.",ABoringDystopia,"12 year old felon, professional caregiver probation for child murderer.",rlDrakesden,2020-05-08 12:33,0
931,"Same people who buy Fox Hotdogs, made from 100% Alabama fox and the maximum legally allowed amount of roaches, rat feces, hair, dirt, teamsters and pangolin scales. Guaranteed.",ABoringDystopia,Rupert Murdoch is tied to the murder of 3 attorneys investigating the disappearance of an underage Thai prostitute (male) on his property in Madrid,Amateurlapse,2020-04-17 17:23,0
932,"1. Due to this pandemic, we have judges ruling that it’s appropriate to bar a married parent from their home and child because exposing a child to the risk of COVID-19 counts as ‘child endangerment.’ 2. Many essential employees would lose everything they own within 1-2 paychecks if they quit their jobs, due to intentional poverty-level wages, healthcare and life insurance being tied to jobs because only people earning money for the rich deserve health in America, and the rising costs of virtually everything. They have no alternative but to expose themselves to COVID-19 on a daily basis. Many of them are not provided with adequate — or even any — PPE. They are held in place by threat of starvation and financial ruin, told they should view this as their “civic duty” by people who have retreated to the safety of their mansions, and lauded as “heroes” — and of course they are, and always have been, by necessity of supporting families through their own blood, sweat and tears — but the word is used to cover up what they really are, and always have been: slaves and hostages. Refusing to enact UBI, rather than funnel a trillion dollars a day into banks and shovel yet more billions into the pockets of billionaires, America is perpetuating not only child endangerment, but a conscious and intentional genocide of the poor, and then scapegoating the poor themselves for not being better equipped to deal with the global pandemic they were:A. Never paid well enough to prepare for, and:B. Consistently told by world “leaders” was not going to be serious, even as these “leaders” sold off fortunes in insider trading. America’s “leaders” are liars, thieves and murderers. One would think there would no longer be a place for them to hide, but they stand entirely concealed behind the inaction of those keeping them in power to maintain their own more modest power and fortunes, behind the poverty-stricken, exhausted masses, whose time is intentionally tied to inhumane, out of date, industrial-era work hours, behind the apathy they’ve created in everyone through media burnout, and through normalization of an insidiously gradual dictatorship.",ABoringDystopia,To assume these things are true:,TheLernaeanHydra,2020-04-09 17:14,1
933,"At no point should anyone defend the police.Someone has to go incredibly out of their way to become one, to stay one, to work their way into the SWAT team, and then go out on no-knocks.At no point does it become a tragedy on their side. Just virulent whiteknight mentality that they are doing the right thing and it ended badly, like normal, sane people knew it would. DONT RAID YOUR OWN CITIZENS.",ABoringDystopia,"They did a no-knock raid at THE WRONG HOUSE, and the shot a sleeping EMT 8 times. When the boyfriend shot back at the random men who broke into his house, they claimed attempted murder",Torre82min,2020-04-08 0:36,1
934,"I hope the EMTs in the city dont forget this. Regardless of working proximity, if they keep asking for the police to not shoot them over the radio for every call they're on and keep their hands up until they need to do their job any time they are on the same call as police, I think it might send a message. I hope at least",ABoringDystopia,"They did a no-knock raid at THE WRONG HOUSE, and the shot a sleeping EMT 8 times. When the boyfriend shot back at the random men who broke into his house, they claimed attempted murder",dappermermaid,2020-04-08 17:32,0
935,"Didn't work out great in this case, did it? Is there a scenario where someone killed the cops coming after them that you envision working out well for them?",ABoringDystopia,"They did a no-knock raid at THE WRONG HOUSE, and the shot a sleeping EMT 8 times. When the boyfriend shot back at the random men who broke into his house, they claimed attempted murder",ActionistRespoke,2020-04-08 6:04,1
936,"The world was VASTLY more fucked up BEFORE civilization, you do realize this right?   We live in the best time ever, and every once in awhile things like this happen. Planes crash, the police knock on the wrong house, someone perfectly healthy gets cancer. This does not mean the whole world has gone to hell in a hand basket.",ABoringDystopia,"They did a no-knock raid at THE WRONG HOUSE, and the shot a sleeping EMT 8 times. When the boyfriend shot back at the random men who broke into his house, they claimed attempted murder",DeathByDrumming,2020-04-08 15:43,1
937,"Based on all the stories about police down there I believe it. I’m canadian and while the cops where I live can be douche bags, I’m not really afraid of them.",ABoringDystopia,"They did a no-knock raid at THE WRONG HOUSE, and the shot a sleeping EMT 8 times. When the boyfriend shot back at the random men who broke into his house, they claimed attempted murder",,2020-04-08 14:31,1
938,"that + treated glass windows makes house invasion take a _lot_ of effort and demolition. potentially worth investing in, for those who own homes out there.",ABoringDystopia,"They did a no-knock raid at THE WRONG HOUSE, and the shot a sleeping EMT 8 times. When the boyfriend shot back at the random men who broke into his house, they claimed attempted murder",zClarkinator,2020-04-08 3:58,0
939,I saw one time on tv they had to saw in. It took ages and once they got in it was just a small storage unit that wasnt even connected to the unit the warrant was for hahaha,ABoringDystopia,"They did a no-knock raid at THE WRONG HOUSE, and the shot a sleeping EMT 8 times. When the boyfriend shot back at the random men who broke into his house, they claimed attempted murder",IGrowGreen,2020-04-08 5:44,0
940,Legalize and tax. There are some things that create a danger to self and the public that should continue to be prohibited. Guns are not the solution to drugs.,ABoringDystopia,"They did a no-knock raid at THE WRONG HOUSE, and the shot a sleeping EMT 8 times. When the boyfriend shot back at the random men who broke into his house, they claimed attempted murder",veilwalker,2020-04-08 15:50,0
941,"No. Many lives were lost in the American revolution. If another revolution happens, so will bloodshed. It could be argued that it didn't work out well for the revolutionaries or the British back then either.",ABoringDystopia,"They did a no-knock raid at THE WRONG HOUSE, and the shot a sleeping EMT 8 times. When the boyfriend shot back at the random men who broke into his house, they claimed attempted murder",ciaisi,2020-04-08 6:24,1
942,"The NRA doesn't care about *any* Americans, unless those Americans are lining NRA leaderships pockets, and even then its debatable if they actually care about them or not given they seem to care more about Russians than Americans these days.",ABoringDystopia,"They did a no-knock raid at THE WRONG HOUSE, and the shot a sleeping EMT 8 times. When the boyfriend shot back at the random men who broke into his house, they claimed attempted murder",Dislol,2020-04-09 5:41,1
943,"Ok, I guess what I really meant was that I hope somebody will market them in such a way that they become commonplace.",ABoringDystopia,"They did a no-knock raid at THE WRONG HOUSE, and the shot a sleeping EMT 8 times. When the boyfriend shot back at the random men who broke into his house, they claimed attempted murder",CubistHamster,2020-04-08 6:25,0
944,"That is explainable by general incompetence.They invaded the wrong house, got shot at/opened fire (I don't know which side fired first) and just shot at everything in that general direction. That the girlfriend died and he lived is just bad luck/good luck on their part.",ABoringDystopia,"They did a no-knock raid at THE WRONG HOUSE, and the shot a sleeping EMT 8 times. When the boyfriend shot back at the random men who broke into his house, they claimed attempted murder",10ebbor10,2020-04-08 12:42,0
945,Left the Army after eight years after coming to a similar realization. I still miss the lifestyle but there’s a point where I couldn’t convince myself it was about helping others anymore.,ABoringDystopia,"They did a no-knock raid at THE WRONG HOUSE, and the shot a sleeping EMT 8 times. When the boyfriend shot back at the random men who broke into his house, they claimed attempted murder",silver_pockets,2020-04-08 14:05,1
946,"That means the whole org has to go.One bad apple ruins the barrel.  A barrel full of rotten apples ruins any good ones you toss in.Your ""good cops"" whoever they are deserve better than to be in a police force that will absolutely corrupt them and make them bad people before long.",ABoringDystopia,"They did a no-knock raid at THE WRONG HOUSE, and the shot a sleeping EMT 8 times. When the boyfriend shot back at the random men who broke into his house, they claimed attempted murder",ldobehardcore,2020-04-08 1:42,0
947,"the real dystopic part is those who can't afford to take such precautions, or those who rent and don't have the right to take such measures to protect themselves.",ABoringDystopia,"They did a no-knock raid at THE WRONG HOUSE, and the shot a sleeping EMT 8 times. When the boyfriend shot back at the random men who broke into his house, they claimed attempted murder",zClarkinator,2020-04-08 8:34,1
948,"What hasn’t worked? In one sentence you claim the system is the problem, and in the next you say the only way to change the system doesn’t work, when we have historical evidence that it HAS worked. You may comfortable with the current system, but it doesn’t work for tens of millions of people who are barely scraping by, trying to survive. So if a revolution is coming, tough luck buddy.",ABoringDystopia,"They did a no-knock raid at THE WRONG HOUSE, and the shot a sleeping EMT 8 times. When the boyfriend shot back at the random men who broke into his house, they claimed attempted murder",Justinianus910,2020-04-08 18:47,1
949,"I mean at a certain point, even if alcohols negative effects exist, plenty of people use it and live full and healthy lives. Everything is fine in relative moderation. And at the end of the day, what good is life without it’s joys? If someone gets joy from going out with friends on the weekend and drinking some beers, the good absolutely outweighs the bad",ABoringDystopia,"They did a no-knock raid at THE WRONG HOUSE, and the shot a sleeping EMT 8 times. When the boyfriend shot back at the random men who broke into his house, they claimed attempted murder",,2020-04-08 16:06,0
950,"You're describing literally the best possible doc. Good with harvesting organs, as good at butchering bodies as putting them back together. The only thing that'd make me reconsider letting him live is if he's a chemical fascination pyromaniac too",ABoringDystopia,"They did a no-knock raid at THE WRONG HOUSE, and the shot a sleeping EMT 8 times. When the boyfriend shot back at the random men who broke into his house, they claimed attempted murder",electronicbody,2020-04-08 10:26,1
951,"“Good luck finding the kids that belong to you (if you’re still alive) and good luck staying alive after you find them, and oh, yeah, sorry not sorry.”",ABoringDystopia,"Trump: here, you can have back the kids I didn't lose or murder.",TheLernaeanHydra,2020-03-27 1:52,1
952,I would dedicate my entire life to pressing that button if it affected the owners of health insurance companies and other evil people.,ABoringDystopia,Fuel companies getting murdered by one person.,o0flatCircle0o,2020-03-07 9:18,1
953,"This always surprised me that you don't hear this more ""Ex employee attempts to murder (insert billionaire like bezos) after being fuck over ,  he said at least now i get a bed and a hot meal""",ABoringDystopia,A reward for murder,Supremebeing101,2020-02-28 10:38,1
954,"for real, one single night in there on false charges was enough to be the most terrifying experience i've had in my life. It's not a place anyone, even those on the streets would want to be.",ABoringDystopia,A reward for murder,SleuthMechanism,2020-03-05 22:48,1
955,Holy fuck. As a parent i honestly have no idea how i would react to all of this. I can assure you i would not take it well. So sorry for their loss,ABoringDystopia,Mature people don’t murder people though 🧐,mostly_kinda_sorta,2020-02-25 17:25,0
956,"I get it, and I really really hope i never find out. I think knowing my other kids needed me is all that would hold me back from losing it. If someone took all my boys i really wouldnt have anything to live for, no reason to stay sane or civilized",ABoringDystopia,Mature people don’t murder people though 🧐,mostly_kinda_sorta,2020-02-25 19:54,1
957,"Ah shit. This made me cry for what I assume was the deep anguish, regret, and existential dread that man must’ve felt in his last minutes.",ABoringDystopia,"The ""justice"" system legally murdered a man who had changed over the years, because the criminal justice system essentializes people as ""bad,"" and fails to properly act as a rehabilitation facility.",manic_panic,2020-02-22 23:09,0
958,You have people rotting in prison for real petty things that do not have an impact on the community. Small petty Marijuana cases and such. People are even going to prison over medical debt so it is a dehumanizing experience.,ABoringDystopia,"The ""justice"" system legally murdered a man who had changed over the years, because the criminal justice system essentializes people as ""bad,"" and fails to properly act as a rehabilitation facility.",4thstories,2020-02-22 20:56,1
959,One of his hobbies is techy stuff so he's an investor I a lot of tech startups - like this one.,ABoringDystopia,"An app to murder women, very cool and normal.",LilacGrand,2020-01-24 1:07,0
960,"My eldest son just moved out of our home to start an exciting life on his own.  Unfortunately it's really far away. Not being close, feeling like I can't protect him feels awful. So this story, that poor guy screaming in a panic for his dad has me all torn up.The artwork is well done though, powerful.",ABoringDystopia,"Of the 6 cops who murdered him, not a single one was imprisoned...",FerretFarm,2020-01-16 21:52,0
961,"The best part is they planned the whole thing, they were on tape talking enthusiastically about murdering him. For citizens that's first degree murder, for cops it's just a way to pass the time.",ABoringDystopia,"Of the 6 cops who murdered him, not a single one was imprisoned...",AlwaysSaysDogs,2020-01-17 6:46,1
962,"This happened in the city i live in, I walk by the spot he was killed at everyday going to work. The police were suspended & then found jobs in another city.",ABoringDystopia,"Of the 6 cops who murdered him, not a single one was imprisoned...",CuteNFuzzy,2020-01-17 6:13,1
963,He didn't just call for his father for help. He called for his father nearly 30 times while being beaten to death.,ABoringDystopia,"Of the 6 cops who murdered him, not a single one was imprisoned...",mypickaxebroke,2020-01-17 7:29,0
964,"I always think that it’s only a matter of time before people will get fed up and give cops a taste of some vigilante justice, but that time never comes no matter what they do.",ABoringDystopia,"Of the 6 cops who murdered him, not a single one was imprisoned...",purritowraptor,2020-01-17 5:58,0
965,I am sick to my stomach right now. I've read the Wikipedia page of this 30 minutes and I still feel unwell.Jesus fucking Christ,ABoringDystopia,"Of the 6 cops who murdered him, not a single one was imprisoned...",print0002,2020-01-17 12:03,0
966,"Just to add to this""On July 3, 2012, Ramos' employment was terminated.[74] According to a statement issued by Fullerton Police, Joe Wolfe is no longer employed by the department as of July 16, 2012.[75] Jay Cicinelli is no longer employed by Fullerton Police as of July 20, 2012.[76]""",ABoringDystopia,"Of the 6 cops who murdered him, not a single one was imprisoned...",PuppieWayne,2020-01-17 7:35,0
967,Police officers have been this way since the first time a person was given authority over the freedom of others. It will never change. There will always be those that abuse it.,ABoringDystopia,"Of the 6 cops who murdered him, not a single one was imprisoned...",confused_n_disturbed,2020-01-17 11:14,1
968,"I don't believe in heaven or hell, but damn it I wish I would. What could be considered enough justice to those 6? I cant think of any example of such senseless brutality, cowardice and lack of compassion anywhere else in nature. They are even worst than the worst criminals I've ever heard of.",ABoringDystopia,"Of the 6 cops who murdered him, not a single one was imprisoned...",Ezekhiel2517,2020-01-17 13:56,0
969,That seriously made me cry. How the fuck were they acquitted?! The only thing I can think is that the jury had a fear of retaliation?,ABoringDystopia,"Of the 6 cops who murdered him, not a single one was imprisoned...",catscradle474,2020-01-17 14:39,0
970,"As an American I do fear.  I fear that one slip up, one mistake can undo the long slog my parents and grandparents have had to make to pull themselves out of poverty.   I fear that I will have to work as hard as they did, make the sacrifices they made.  All while this undeserving gods sit in towers on high, robbing the people blind and holding total control over us all.  I question if there’s really anything I can even do to fight back without destroying myself.",ABoringDystopia,"Of the 6 cops who murdered him, not a single one was imprisoned...",undreamedgore,2020-01-17 7:06,0
